{"binding_signal_projection_version":"binding_signal_projection_v1","capability_audit_context_version":"capability_audit_context_v1","capability_binding_manifest_hash":"sha256:53bfb638bfa2fd2871b97c9ca24f2293a053915d4fa935266a7d4fa16d7b95b4","claim_comparison_spec_version":"claim_comparison_spec_v1","execution_behavior_release_hash":"sha256:fd67c5f87bdae127ce45f96b0b808d116669bd9e1ad1d4cbc65238693072c5f6","knot_coverage_manifest_v2_hash":"sha256:8ad0bc15b5191962f626f57a9b287f6f1dca803dcc0070e618cd9df9bd4c4468","result_event_schema_version":"server_tool_result_event_v1","schema_version":"knot_audit_capability_track_v2","snapshot_audit_context_version":"snapshot_bundle_audit_context_v1","tool_environment_hash":"sha256:3e2f86ce631139f590225217aa47a733ae1f3e12311c4fc9d26c8ab5cca97adb","track_hash":"sha256:c4d9cc4f95797e09d215a1d5cbeccf3cedddc5ca02c39458e611f99fdc9e6ccd","trusted_comparator_version":"same_dimension_polarity_v1"}
